question,option_a,option_b,option_c,option_d,correct_answer,explanation,category
"Thủ đô của Việt Nam là thành phố nào?","Thành phố Hồ Chí Minh","Hà Nội","Đà Nẵng","Cần Thơ",2,"Hà Nội là thủ đô của nước Cộng hòa Xã hội chủ nghĩa Việt Nam từ năm 1976, là trung tâm chính trị - hành chính của cả nước.","Địa lý Việt Nam"
"Kết quả của phép tính 15 + 25 × 2 là bao nhiêu?","80","65","55","70",2,"Theo thứ tự ưu tiên của các phép tính: 25 × 2 = 50, sau đó 15 + 50 = 65","Toán học cơ bản"
"Nguyên tố hóa học nào có ký hiệu là ""O""?","Oxi (Oxygen)","Vàng (Gold)","Bạc (Silver)","Sắt (Iron)",1,"Oxi (Oxygen) có ký hiệu hóa học là O, là nguyên tố thiết yếu cho sự sống và quá trình hô hấp của con người.","Hóa học"
"Việt Nam tuyên bố độc lập vào ngày nào?","2 tháng 9 năm 1945","30 tháng 4 năm 1975","19 tháng 8 năm 1945","2 tháng 7 năm 1976",1,"Ngày 2 tháng 9 năm 1945, Chủ tịch Hồ Chí Minh đọc bản Tuyên ngôn độc lập tại Quảng trường Ba Đình, Hà Nội.","Lịch sử Việt Nam"
"Tác giả của tác phẩm ""Truyện Kiều"" là ai?","Nguyễn Du","Hồ Xuân Hương","Nguyễn Trãi","Nguyễn Bỉnh Khiêm",1,"Nguyễn Du (1765-1820) là tác giả của kiệt tác ""Truyện Kiều"", được coi là đỉnh cao của văn học cổ điển Việt Nam.","Văn học Việt Nam"
